{
  "$schema": "https://json-schema.org/draft/2020-12/schema",
  "type": "object",
  "additionalProperties": false,
  "required": ["id", "resolution_notes", "base_url", "docs_url", "auth_type", "free_tier", "free_tier_limits", "rate_limits", "cors", "example_request", "example_response_snippet", "description", "status"],
  "properties": {
    "id": { "type": "string" },
    "resolution_notes": { "type": "string", "maxLength": 600 },
    "base_url": { "type": ["string", "null"], "pattern": "^https?://" },
    "docs_url": { "type": ["string", "null"], "pattern": "^https?://" },
    "auth_type": { "type": ["string", "null"], "enum": ["none", "apiKey", "oauth2", "basic", "jwt", "other", null] },
    "free_tier": { "type": ["boolean", "null"] },
    "free_tier_limits": { "type": ["string", "null"], "maxLength": 300 },
    "rate_limits": { "type": ["string", "null"], "maxLength": 300 },
    "cors": { "type": ["string", "null"], "enum": ["yes", "no", "unknown", null] },
    "example_request": { "type": ["string", "null"], "maxLength": 600 },
    "example_response_snippet": { "type": ["string", "null"], "maxLength": 800 },
    "description": { "type": ["string", "null"], "maxLength": 600 },
    "status": { "type": ["string", "null"], "enum": ["operational", "degraded", "defunct", null] }
  }
}
