{
  "id": "coingecko",
  "resolution_notes": "Both free_tier_limits and rate_limits were disputed. Verified against CoinGecko's live pricing page and docs: Demo remains 10k calls/month and 30 calls/min; paid rate limits should not hardcode a 500\u20131000+ range without the current plan matrix. Corrections applied only to those two fields; other entry fields kept as-is.",
  "base_url": null,
  "docs_url": null,
  "auth_type": null,
  "free_tier": null,
  "free_tier_limits": "Demo API: 10,000 calls/month, 30 calls/min",
  "rate_limits": "Demo: 30 calls/min (and 10,000 calls/month). Paid tiers vary by plan on the pricing page; check current plan matrix for Analyst/Lite/Pro/Enterprise rates",
  "cors": null,
  "example_request": null,
  "example_response_snippet": null,
  "description": null,
  "status": null
}