{
  "id": "mobygames",
  "base_url": null,
  "docs_url": null,
  "auth_type": null,
  "free_tier": true,
  "free_tier_limits": "Free access requires application and approval for non-commercial research; non-commercial access is limited to 720 requests/hour, averaging one every 5 seconds, with a maximum of 1 request/second.",
  "rate_limits": "Published and plan-dependent: non-commercial access is 720 requests/hour with a 1 request/second maximum; legacy access is 360/hour; paid plans advertise limits from 0.2 to 8 requests/second.",
  "cors": null,
  "example_request": null,
  "example_response_snippet": null,
  "description": null,
  "status": null,
  "resolution_notes": "free_tier: true; the official subscription FAQ offers application-based free access for non-commercial research: https://www.mobygames.com/api/subscribe/ . free_tier_limits: official docs state 720/hour, average one/5 seconds, max 1/second: https://www.mobygames.com/info/api/#limits . rate_limits: published and plan-dependent; docs give non-commercial and legacy quotas, while current plans list per-second caps: https://www.mobygames.com/info/api/#limits and https://www.mobygames.com/api/subscribe/ ."
}