{
  "id": "wheretheiss-at",
  "base_url": null,
  "docs_url": null,
  "auth_type": null,
  "free_tier": null,
  "free_tier_limits": null,
  "rate_limits": "Approximately 1 request per second (~1 req/sec)",
  "cors": null,
  "example_request": null,
  "example_response_snippet": null,
  "description": null,
  "status": null,
  "resolution_notes": "rate_limits: Verifier B correct. Official developer docs (https://wheretheiss.at/w/developer) document a rate limit of about 1 request per second; original \"not published\" is wrong."
}