{
  "id": "timeapi",
  "base_url": null,
  "docs_url": "https://timeapi.io/swagger/index.html",
  "auth_type": null,
  "free_tier": null,
  "free_tier_limits": null,
  "rate_limits": null,
  "cors": "yes",
  "example_request": null,
  "example_response_snippet": null,
  "description": null,
  "status": null,
  "resolution_notes": "docs_url: Replace with https://timeapi.io/swagger/index.html; the official homepage's API Docs link goes to https://timeapi.io/swagger/, which currently redirects there. Evidence: https://timeapi.io/ and https://timeapi.io/swagger/. cors: Set to yes; the official changelog explicitly states CORS was enabled for all endpoints. Evidence: https://timeapi.io/home/changelog."
}