{
  "id": "scrapingbee",
  "base_url": null,
  "docs_url": null,
  "auth_type": null,
  "free_tier": false,
  "free_tier_limits": "1,000 free trial credits after signup (credit card required); no ongoing free plan",
  "rate_limits": "Plan-based concurrent request limits (e.g. Freelance 5, Startup 50, Business 100, Business+ 200); no published RPS",
  "cors": null,
  "example_request": null,
  "example_response_snippet": null,
  "description": null,
  "status": null,
  "resolution_notes": "free_tier: false \u2014 pricing shows a free trial (1,000 credits), not an ongoing free tier (https://www.scrapingbee.com/pricing/). free_tier_limits: 1,000 trial credits with card signup; no ongoing free plan (same page). rate_limits: concurrency is plan-based on pricing; no public RPS (https://www.scrapingbee.com/pricing/)."
}