{
  "id": "currents-api",
  "resolution_notes": "Both verifiers disputed free_tier_limits on plan naming (Starter vs Basic). Official pricing (currentsapi.services/en/pricing) was checked; free tier is 600 requests/day under the plan name shown there. All other entry fields were confirmed or left unchanged; cors remains unknown.",
  "base_url": null,
  "docs_url": null,
  "auth_type": null,
  "free_tier": null,
  "free_tier_limits": "600 req/day free (Starter plan)",
  "rate_limits": null,
  "cors": null,
  "example_request": null,
  "example_response_snippet": null,
  "description": null,
  "status": null
}