{
  "id": "agromonitoring",
  "base_url": null,
  "docs_url": null,
  "auth_type": null,
  "free_tier": null,
  "free_tier_limits": null,
  "rate_limits": null,
  "cors": null,
  "example_request": null,
  "example_response_snippet": null,
  "description": null,
  "status": null,
  "resolution_notes": "base_url: CONFIRMED. The current official Current Weather API documentation explicitly lists https://api.agromonitoring.com/agro/1.0/weather as its API call, establishing https://api.agromonitoring.com/agro/1.0 as the correct shared base URL. Evidence: https://agromonitoring.com/api/current-weather"
}