{
  "id": "anthropic",
  "resolution_notes": "free_tier: original false is correct \u2014 Anthropic Claude API is pay-as-you-go with no ongoing free tier; Verifier A conflated one-time signup credits with a free tier. free_tier_limits: original \"no free tier\" is correct per pricing page; any new-account promo credits are one-time and not a free plan.",
  "base_url": null,
  "docs_url": null,
  "auth_type": null,
  "free_tier": false,
  "free_tier_limits": "no free tier",
  "rate_limits": null,
  "cors": null,
  "example_request": null,
  "example_response_snippet": null,
  "description": null,
  "status": null
}